{
  "kind": "ApprovalDecision",
  "decision_id": "<approval-decision-id>",
  "task_id": "<task-id>",
  "approval_request_ref": "<approval request ref>",
  "user_response": {
    "text": "<exact user response text>",
    "sha256": "<sha256 of exact user response text>"
  },
  "edit_paths": ["<exact approved path>"],
  "commands": ["<exact approved command or none>"],
  "side_effects": ["<exact approved side effect or none>"],
  "git_scope": "<none|exact git scope>",
  "release_scope": "<none|exact release scope>",
  "exclusions": ["<excluded side effect>"],
  "source_refs": [
    {
      "path": "<source path>",
      "sha256": "<current source sha256>"
    }
  ],
  "lifecycle_transition": false
}
